{
  "schemaVersion": "1.0.0",
  "registerVersion": "2026-09-30",
  "defaultCheckedOn": "2026-09-30",
  "claims": [
    {
      "id": "SRC-VEN-LION-01",
      "publisher": "Venezia Unica / City of Venice",
      "pageTitle": "Castello, Naval Art and Traditions",
      "url": "https://www.veneziaunica.it/en/things-to-do-in-venice/itineraries/castello-naval-art-and-traditions",
      "retrievedOn": "2026-09-29",
      "claimType": "fact",
      "claimText": "The winged lion of Saint Mark is a symbol of Venice.",
      "stability": "stable",
      "requiredRecheckOn": "2026-10-03",
      "usedBy": ["VEN-01"]
    },
    {
      "id": "SRC-VEN-RIALTO-01",
      "publisher": "Venezia Unica / City of Venice",
      "pageTitle": "Rialto Bridge",
      "url": "https://www.veneziaunica.it/en/things-to-do-in-venice/monuments-and-theatres/rialto-bridge",
      "retrievedOn": "2026-09-29",
      "claimType": "fact",
      "claimText": "Rialto Bridge was built from 1588 to 1592 and remained the Grand Canal's only bridge until the nineteenth century.",
      "stability": "stable",
      "requiredRecheckOn": "2026-10-03",
      "usedBy": ["VEN-02"]
    },
    {
      "id": "SRC-VEN-TRANSIT-01",
      "publisher": "Venezia Unica / City of Venice",
      "pageTitle": "Public transport",
      "url": "https://www.veneziaunica.it/en/things-to-do-in-venice/public-transport",
      "retrievedOn": "2026-09-29",
      "claimType": "visitor",
      "claimText": "ACTV water transport serves Venice, while lagoon routes connect islands including Murano and Burano.",
      "stability": "volatile",
      "requiredRecheckOn": "2026-10-06",
      "usedBy": ["ISL-02"]
    },
    {
      "id": "SRC-ISL-MURANO-01",
      "publisher": "Venezia Unica / City of Venice",
      "pageTitle": "Murano",
      "url": "https://www.veneziaunica.it/en/things-to-do-in-venice/venice-areas/islands/murano",
      "retrievedOn": "2026-09-29",
      "claimType": "fact",
      "claimText": "Murano is known internationally for glassmaking workshops and artistic glass.",
      "stability": "stable",
      "requiredRecheckOn": "2026-10-03",
      "usedBy": ["ISL-01"]
    },
    {
      "id": "SRC-ISL-GLASS-01",
      "publisher": "Fondazione Musei Civici di Venezia",
      "pageTitle": "Glass Museum — Museum",
      "url": "https://museovetro.visitmuve.it/en/il-museo/museum/",
      "retrievedOn": "2026-09-29",
      "claimType": "fact",
      "claimText": "Murano's Glass Museum was founded in 1861 and preserves glass made on the island across centuries.",
      "stability": "stable",
      "requiredRecheckOn": "2026-10-03",
      "usedBy": ["ISL-01"]
    },
    {
      "id": "SRC-ISL-BURANO-TRAD-01",
      "publisher": "Venezia Unica / City of Venice",
      "pageTitle": "Burano",
      "url": "https://www.veneziaunica.it/en/things-to-do-in-venice/venice-areas/isole/burano",
      "retrievedOn": "2026-09-29",
      "claimType": "tradition",
      "claimText": "A popular tradition says bright house colours helped returning fishers recognise their homes in fog.",
      "stability": "stable",
      "requiredRecheckOn": "2026-10-03",
      "usedBy": ["ISL-03"]
    },
    {
      "id": "SRC-ISL-BURANO-FACT-01",
      "publisher": "Venezia Unica / City of Venice",
      "pageTitle": "Burano",
      "url": "https://www.veneziaunica.it/en/things-to-do-in-venice/venice-areas/isole/burano",
      "retrievedOn": "2026-09-29",
      "claimType": "fact",
      "claimText": "The source explains the rainbow house practice as comparatively recent and connected with marking property boundaries.",
      "stability": "stable",
      "requiredRecheckOn": "2026-10-03",
      "usedBy": ["ISL-03"]
    },
    {
      "id": "SRC-ISL-BURANO-LEG-01",
      "publisher": "Venezia Unica / City of Venice",
      "pageTitle": "Burano",
      "url": "https://www.veneziaunica.it/en/things-to-do-in-venice/venice-areas/isole/burano",
      "retrievedOn": "2026-09-29",
      "claimType": "legend",
      "claimText": "A local legend imagines sea foam becoming a lace bridal veil.",
      "stability": "stable",
      "requiredRecheckOn": "2026-10-03",
      "usedBy": ["ISL-03"]
    },
    {
      "id": "SRC-ISL-LACE-01",
      "publisher": "Venezia Unica / City of Venice",
      "pageTitle": "Lace Museum",
      "url": "https://www.veneziaunica.it/en/things-to-do-in-venice/civic-museums-of-venice/lace-museum",
      "retrievedOn": "2026-09-29",
      "claimType": "fact",
      "claimText": "Burano's Lace Museum occupies the historic lace school founded in 1872 and documents Venetian lace across several centuries.",
      "stability": "stable",
      "requiredRecheckOn": "2026-10-03",
      "usedBy": ["ISL-03"]
    },
    {
      "id": "SRC-VER-ARENA-01",
      "publisher": "Visit Verona / Destination Verona & Garda Foundation",
      "pageTitle": "Arena Amphitheatre",
      "url": "https://www.visitverona.it/en/poi/arena-amphitheatre",
      "retrievedOn": "2026-09-29",
      "claimType": "fact",
      "claimText": "The Romans built Verona's Arena around the middle of the first century AD.",
      "stability": "stable",
      "requiredRecheckOn": "2026-10-03",
      "usedBy": ["VER-01"]
    },
    {
      "id": "SRC-VER-ARENA-VISIT-01",
      "publisher": "Visit Verona / Destination Verona & Garda Foundation",
      "pageTitle": "Arena Amphitheatre",
      "url": "https://www.visitverona.it/en/poi/arena-amphitheatre",
      "retrievedOn": "2026-09-30",
      "claimType": "visitor",
      "claimText": "The official 2026 event calendar lists a 15:00 closing time on Thursday 8 October, with last entry 30 minutes before; schedules may change.",
      "stability": "volatile",
      "requiredRecheckOn": "2026-10-07",
      "usedBy": ["VER-01"]
    },
    {
      "id": "SRC-VER-JULIET-FACT-01",
      "publisher": "Visit Verona / Destination Verona & Garda Foundation",
      "pageTitle": "Juliet's House and Museum",
      "url": "https://www.visitverona.it/en/poi/juliet-s-house-and-museum",
      "retrievedOn": "2026-09-29",
      "claimType": "fact",
      "claimText": "The medieval tower house is documented from 1351; Verona acquired it in 1905 and the famous balcony was added during its 1939–1940 restoration.",
      "stability": "stable",
      "requiredRecheckOn": "2026-10-03",
      "usedBy": ["VER-02"]
    },
    {
      "id": "SRC-VER-JULIET-STORY-01",
      "publisher": "Visit Verona / Destination Verona & Garda Foundation",
      "pageTitle": "Juliet's House and Museum",
      "url": "https://www.visitverona.it/en/poi/juliet-s-house-and-museum",
      "retrievedOn": "2026-09-29",
      "claimType": "tradition",
      "claimText": "The house's Juliet association developed after Luigi da Porto's and Shakespeare's literary versions; it was identified as the Capulets' house in the eighteenth century.",
      "stability": "stable",
      "requiredRecheckOn": "2026-10-03",
      "usedBy": ["VER-02"]
    },
    {
      "id": "SRC-VER-JULIET-VISIT-01",
      "publisher": "Visit Verona / Destination Verona & Garda Foundation",
      "pageTitle": "Juliet's House and Museum",
      "url": "https://www.visitverona.it/en/poi/juliet-s-house-and-museum",
      "retrievedOn": "2026-09-30",
      "claimType": "visitor",
      "claimText": "From 1 April 2026 the visitor route enters through Teatro Nuovo in Piazzetta Navona; all visit options require advance online booking and tickets are not sold on site.",
      "stability": "volatile",
      "requiredRecheckOn": "2026-10-07",
      "usedBy": ["VER-02"]
    },
    {
      "id": "SRC-VER-PONTE-01",
      "publisher": "Visit Verona / Destination Verona & Garda Foundation",
      "pageTitle": "Ponte Pietra",
      "url": "https://www.visitverona.it/en/poi/ponte-pietra",
      "retrievedOn": "2026-09-29",
      "claimType": "fact",
      "claimText": "Ponte Pietra spans the Adige with five arches and is open to pedestrians and bicycles rather than cars.",
      "stability": "stable",
      "requiredRecheckOn": "2026-10-03",
      "usedBy": ["VER-03"]
    },
    {
      "id": "SRC-VER-ERBE-01",
      "publisher": "Visit Verona / Destination Verona & Garda Foundation",
      "pageTitle": "Piazza Erbe",
      "url": "https://www.visitverona.it/en/poi/piazza-erbe",
      "retrievedOn": "2026-09-29",
      "claimType": "fact",
      "claimText": "Piazza Erbe is Verona's oldest square and occupies the area of the Roman forum.",
      "stability": "stable",
      "requiredRecheckOn": "2026-10-03",
      "usedBy": ["VER-02"]
    },
    {
      "id": "SRC-TRIP-VALEGGIO-01",
      "publisher": "Visit Verona / Destination Verona & Garda Foundation",
      "pageTitle": "Valeggio sul Mincio and Borghetto",
      "url": "https://www.visitverona.it/en/explore/a-magical-mix-of-history-and-countryside",
      "retrievedOn": "2026-09-30",
      "claimType": "visitor",
      "claimText": "Valeggio and Borghetto form one geographic cluster south of Lake Garda, described as about half an hour from Verona.",
      "stability": "seasonal",
      "requiredRecheckOn": "2026-10-08",
      "usedBy": ["VER-04", "VER-05"]
    },
    {
      "id": "SRC-TRIP-BORGHETTO-01",
      "publisher": "Visit Verona / Destination Verona & Garda Foundation",
      "pageTitle": "Valeggio sul Mincio and Borghetto",
      "url": "https://www.visitverona.it/en/explore/a-magical-mix-of-history-and-countryside",
      "retrievedOn": "2026-09-29",
      "claimType": "fact",
      "claimText": "Borghetto preserves old stone houses, water mills, and the fortified Ponte Visconteo.",
      "stability": "stable",
      "requiredRecheckOn": "2026-10-03",
      "usedBy": ["VER-05"]
    },
    {
      "id": "SRC-TRIP-KNOT-LEG-01",
      "publisher": "Visit Verona / Destination Verona & Garda Foundation",
      "pageTitle": "Valeggio sul Mincio and Borghetto",
      "url": "https://www.visitverona.it/en/explore/a-magical-mix-of-history-and-countryside",
      "retrievedOn": "2026-09-29",
      "claimType": "legend",